{
  "schemaVersion": "reference-review-policy.v1",
  "policyId": "rrp_v53_reference_review_gate_profile_v2",
  "policyPath": "implementation/governance/reference-review/reference-review-policy.profile-v2.v1.json",
  "authorityBoundaries": {
    "workDefinition": "WORK_PACKAGE_MANIFEST_V1",
    "governanceState": "ONLINE_D1_APPEND_ONLY_GOVERNANCE_LEDGER",
    "engineeringEvidence": "GIT_FROZEN_EVIDENCE",
    "createsSecondStateTruth": false
  },
  "catalog": {
    "path": "implementation/governance/reference-review/reference-candidate-catalog.v1.json",
    "canonicalSha256": "sha256:db37fa9e04dfe5468ef97e13de55c7702b919040fc78755d33a8db7d1018523a",
    "coverage": "INITIAL_P0_P1_BACKFILL_AND_P2_O02_O03",
    "uncoveredWorkPackagesFailClosed": true
  },
  "manifest": {
    "path": "implementation/governance/work-package-manifest.v1.json",
    "canonicalSha256": "sha256:5ff440dc9d437b874a024f74593e09748fa778cae8ea2dfc3ee8653d731ea2bd"
  },
  "candidateSourceBaseline": {
    "path": "docs/plans/通用多企业AI员工平台_v5.2最小验收项与开源参考矩阵_v1.0.md",
    "sha256": "sha256:d326404ed55b43eccdba01287793ea64812aaafa83f02596bd58b3f83ccdad7a",
    "catalogReferenceIds": [
      "R09.KEYCLOAK",
      "R11.OPENFGA",
      "R12.PGVECTOR",
      "R12.POSTGRESQL_RLS",
      "R26.EXTERNAL_SECRETS_OPERATOR",
      "R26.OPENBAO",
      "R26.SPIRE",
      "R27.COSIGN",
      "R27.IN_TOTO",
      "R27.KYVERNO",
      "R27.SLSA",
      "R27.SYFT",
      "R27.TRIVY",
      "R28.CYCLONEDX",
      "R28.FOSSOLOGY",
      "R28.SCANCODE_TOOLKIT",
      "R28.SPDX"
    ]
  },
  "profileBinding": {
    "profileSha256": "sha256:ed6836e5e212a95b66dd386e8bfbe1cf6aa5f37c1b281cfb0514e9aa9f7213f5",
    "sourceCommit": "bc718bc1a069deaa388b9a00e0135c8e9427dd91",
    "executionBaselineDigest": "sha256:36cfdf3f36d5a4f8bbafe519a6edfdc0fe1cfc86a31cf14252daf70a47973aec",
    "bindingStatus": "BOUND_IN_PROFILE_AND_EXECUTION_BASELINE",
    "requiredBackfillWorkPackageIds": [
      "C04",
      "C06",
      "C07"
    ]
  },
  "workPackagePolicies": [
    {
      "workPackageId": "C04",
      "reviewMode": "RETROSPECTIVE_BACKFILL",
      "applicableReferenceIds": [
        "R09.KEYCLOAK"
      ],
      "requiredToolLockDomains": [],
      "applicabilityEvidence": {
        "status": "COMPLETE",
        "evidenceRefs": [
          "implementation/governance/reference-review/p2-profile-backfill/c04/applicability-evidence.v2.json"
        ],
        "evidenceHashes": [
          "sha256:1964a13245e4a52a9c9b1cd1881b931a21d6ab8e25b32d42db7becfc7d4d34e4"
        ],
        "sourceRoots": [
          "lib/keycloak-scim-provisioning-adapter.mjs"
        ],
        "sourceExclusions": []
      },
      "requiredBefore": "PROFILE_APPROVAL"
    },
    {
      "workPackageId": "C06",
      "reviewMode": "RETROSPECTIVE_BACKFILL",
      "applicableReferenceIds": [
        "R11.OPENFGA"
      ],
      "requiredToolLockDomains": [],
      "applicabilityEvidence": {
        "status": "COMPLETE",
        "evidenceRefs": [
          "implementation/governance/reference-review/p2-profile-backfill/c06/applicability-evidence.v2.json"
        ],
        "evidenceHashes": [
          "sha256:a448abd5e722ae8d99cc49d5b6da68d0659d4ba7ca8a7b6aa40b7adb0b0bd844"
        ],
        "sourceRoots": [
          "lib/openfga-pdp.mjs"
        ],
        "sourceExclusions": []
      },
      "requiredBefore": "PROFILE_APPROVAL"
    },
    {
      "workPackageId": "C07",
      "reviewMode": "RETROSPECTIVE_BACKFILL",
      "applicableReferenceIds": [
        "R12.PGVECTOR",
        "R12.POSTGRESQL_RLS"
      ],
      "requiredToolLockDomains": [],
      "applicabilityEvidence": {
        "status": "COMPLETE",
        "evidenceRefs": [
          "implementation/governance/reference-review/p2-profile-backfill/c07/applicability-evidence.v2.json"
        ],
        "evidenceHashes": [
          "sha256:ae36288109452dcb74241b03192ce6420da3827dd9d72de3256903b3db453d3e"
        ],
        "sourceRoots": [
          "implementation/p1/c07/postgresql/0011_tenant_data_isolation.sql",
          "implementation/p1/c07/postgresql/0012_tenant_data_runtime_roles.sql"
        ],
        "sourceExclusions": []
      },
      "requiredBefore": "PROFILE_APPROVAL"
    },
    {
      "workPackageId": "O02",
      "reviewMode": "PROSPECTIVE",
      "applicableReferenceIds": [
        "R26.EXTERNAL_SECRETS_OPERATOR",
        "R26.OPENBAO",
        "R26.SPIRE"
      ],
      "requiredToolLockDomains": [
        "O02_SECRETS_SYSTEM",
        "O02_WORKLOAD_IDENTITY"
      ],
      "applicabilityEvidence": {
        "status": "UNPROVED",
        "evidenceRefs": [],
        "evidenceHashes": [],
        "sourceRoots": [
          "app",
          "implementation",
          "lib"
        ],
        "sourceExclusions": []
      },
      "requiredBefore": "START_AUTHORIZATION"
    },
    {
      "workPackageId": "O03",
      "reviewMode": "PROSPECTIVE",
      "applicableReferenceIds": [
        "R27.COSIGN",
        "R27.IN_TOTO",
        "R27.KYVERNO",
        "R27.SLSA",
        "R27.SYFT",
        "R27.TRIVY",
        "R28.CYCLONEDX",
        "R28.FOSSOLOGY",
        "R28.SCANCODE_TOOLKIT",
        "R28.SPDX"
      ],
      "requiredToolLockDomains": [
        "O03_ADMISSION_CONTROLLER",
        "O03_LICENSE_SCANNER",
        "O03_SBOM_GENERATOR",
        "O03_SIGNER_AND_VERIFIER",
        "O03_VULNERABILITY_SCANNER"
      ],
      "applicabilityEvidence": {
        "status": "UNPROVED",
        "evidenceRefs": [],
        "evidenceHashes": [],
        "sourceRoots": [
          "app",
          "implementation",
          "lib"
        ],
        "sourceExclusions": []
      },
      "requiredBefore": "START_AUTHORIZATION"
    }
  ],
  "boundaryRules": [
    {
      "boundary": "PRE_START",
      "requirement": "Every applicable candidate has a valid review decision before start authorization."
    },
    {
      "boundary": "DEPENDENCY_ADOPTION",
      "requirement": "Every ADOPT decision has exact version, license, security, data-flow, maintenance, exit, ADR and required PoC evidence before a dependency lock."
    },
    {
      "boundary": "IMPLEMENTATION_CONFORMANCE",
      "requirement": "Every implemented dependency digest matches its approved ADOPT Receipt before VERIFIED."
    },
    {
      "boundary": "RELEASE",
      "requirement": "O03 separately verifies SBOM, provenance, signatures, vulnerabilities, licenses and admission."
    }
  ],
  "governanceEffect": "NONE",
  "isProgressTracker": false,
  "selfAuthorizing": false
}
